{
  "$schema": "../../schemas/dungeon-piece.schema.json",
  "schema_version": 1,
  "piece_id": "cobbleventure:dungeon_piece/pokemon_tower/stairs_down",
  "structure": "cobbleventure:dungeon_pieces/pokemon_tower/stairs_down",
  "role": "corridor",
  "size": [
    16,
    16,
    16
  ],
  "weight": 5,
  "allow_rotation": true,
  "tags": [
    "cobbleventure:dungeon_kit/standard_16",
    "cobbleventure:dungeon_theme/pokemon_tower",
    "cobbleventure:dungeon_shape/stairs_down",
    "cobbleventure:dungeon_pool/pokemon_tower_test"
  ],
  "connectors": [
    {
      "id": "west",
      "position": [
        0,
        9,
        7
      ],
      "facing": "west",
      "socket": "cobbleventure:dungeon_socket/standard_6",
      "tags": [
        "cobbleventure:dungeon_kit/standard_16"
      ]
    },
    {
      "id": "east",
      "position": [
        15,
        1,
        7
      ],
      "facing": "east",
      "socket": "cobbleventure:dungeon_socket/standard_6",
      "tags": [
        "cobbleventure:dungeon_kit/standard_16"
      ]
    }
  ],
  "markers": []
}
